"NoW January 23, 2019",,0
GAMES,,0
Westworld Mobile shuts down following Bethesda lawsuit ,,http://www.gamasutra.com/view/news/334581/Westworld_Mobile_shuts_down_following_Bethesda_lawsuit.php
Bethesda bans Fallout 76 players who accessed secret developer room ,,http://www.gamasutra.com/view/news/334635/Bethesda_bans_Fallout_76_players_who_accessed_secret_developer_room.php
Bethesda confirms bans for visiting hidden Fallout 76“developer room”,,https://arstechnica.com/gaming/2019/01/bethesda-confirms-bans-for-visiting-hidden-fallout-76-developer-room/
Star Control: Origins restored to Steam amid legal battle with series' creators,,http://www.gamesindustry.biz/articles/2019-01-21-star-control-origins-restored-to-steam-amid-legal-battle-with-series-creators
"Eximius developer uses DMCA to reclaim Steam page from publisher: Ammobox claims publisher TheGameWall Studios ""disappeared completely,"" after launch, and lost revenue worth six months of operating expenses",,https://www.gamesindustry.biz/articles/2019-01-21-developer-uses-dmca-to-reclaim-steam-page
Emulator project aims to resurrect classic Mac apps and games without the OS,,https://arstechnica.com/information-technology/2019/01/emulator-project-aims-to-resurrect-classic-mac-apps-and-games-without-the-os/
How machine learning is helping fans remaster retro classics ,,http://www.gamasutra.com/view/news/334771/How_machine_learning_is_helping_fans_remaster_retro_classics.php
Ubisoft issues apology for controversial Assassin's Creed Odyssey DLC ,,http://www.gamasutra.com/view/news/334647/Ubisoft_issues_apology_for_controversial_Assassins_Creed_Odyssey_DLC.php
Ubisoft Apologizes To Players For Assassin's Creed Odyssey DLC Controversy,,https://ca.ign.com/articles/2019/01/18/ubisoft-apologizes-to-players-for-assassins-creed-odyssey-dlc-controversy
Ubisoft apologises for forcing heterosexual romance in Assassin's Creed Odyssey DLC: Publisher explains story-based decision behind relationship but admits it was “poorly executed”,,https://www.gamesindustry.biz/articles/2019-01-17-ubisoft-apologises-for-forcing-heterosexual-romance-in-assassins-creed-odyssey-dlc
"Challenging the inevitability of online harassment | Opinion: Tackling harassment will be a long and bitter march, but understanding it is the first step",,https://www.gamesindustry.biz/articles/2019-01-21-challenging-the-inevitability-of-online-harassment-opinion
Tencent still absent from third round of Chinese game approvals ,,http://www.gamasutra.com/view/news/334887/Tencent_still_absent_from_third_round_of_Chinese_game_approvals.php
Tencent and NetEase absent from third wave of Chinese game approvals: No games from China's two key publishers have been included in the 257 cleared so far,,https://www.gamesindustry.biz/articles/2019-01-22-tencent-and-netease-still-absent-from-third-wave-of-chinese-game-approvals
My Time at Portia devs compensate voice actors for unpaid wages ,,http://www.gamasutra.com/view/news/334892/My_Time_at_Portia_devs_compensate_voice_actors_for_unpaid_wages.php
"Atlas Player Gets Into Admin's Account, Summons Swarm Of Whales And Other Mayhem",,https://kotaku.com/atlas-player-gets-into-admins-account-summons-swarm-of-1831870230
Former Heroes of the Storm team files suit against ex-owner for unpaid wages,,http://www.gamesindustry.biz/articles/2019-01-18-heroes-of-the-storm-team-files-suit-against-owner-for-over-usd50-000-in-unpaid-wages
Square Enix has trademarked the name of Octopath Traveler's art style ,,http://www.gamasutra.com/view/news/334817/Square_Enix_has_trademarked_the_name_of_Octopath_Travelers_art_style.php
"Square Enix trademarks terms for Octopath Traveler's visual style: The publisher now has trademarks for ""HD2D"" and ""HD-2D"" in Europe",,https://www.gamesindustry.biz/articles/2019-01-22-square-enix-trademarks-terms-for-octopath-travelers-visual-style
"Unity CEO clarifies Improbable violations, future plans in AMA: John Riccitiello emphasizes platform's ""developer-first"" focus as driving TOS changes",,https://www.gamesindustry.biz/articles/2019-01-16-unity-ceo-clarifies-improbable-violations-future-plans-in-ama
NBA extends partnership with NBA 2K publisher 2K ,,http://www.gamasutra.com/view/news/334616/NBA_extends_partnership_with_NBA_2K_publisher_2K.php
"Don't Miss: How working on gross, violent games can affect developers ",,http://gamasutra.com/view/news/252241/How_working_on_gross_violent_games_can_mess_with_developers.php
"Netflix: ""We compete with (and lose to) Fortnite more than HBO"" - TV and film streaming service points to Epic's battle royale title as a major competitor",,https://www.gamesindustry.biz/articles/2019-01-18-netflix-we-compete-with-and-lose-to-fortnite-more-than-hbo
Netflix thinks ‘Fortnite’ is a bigger threat than HBO,,https://techcrunch.com/2019/01/18/netflix-thinks-fortnite-is-a-bigger-threat-than-hbo/
Netflix claims Fortnite is now a bigger competitor than HBO ,,0
Insights: The Real Competition for Netflix Is…A Single Videogame? Yup.,,https://www.tubefilter.com/2019/01/22/netflix-competition-fortnite-video-game-insights/
"Cybersecurity firm exposes Fortnite vulnerability: If exploited, hackers could have viewed personal information, purchased items, and overheard chat through affected accounts",,https://www.gamesindustry.biz/articles/2019-01-16-cybersecurity-firm-exposes-fortnite-security-hole
Fortnite Dances Its Way Into More Lawsuits,,https://www.lexology.com/library/detail.aspx?g=a62e721a-8d95-4f49-a83b-a7c219add9b0
Blog: Why the Epic Games Store could be huge for influencers ,,http://www.gamasutra.com/blogs/MeredithHall/20190118/334653/The_Rise_of_The_Influencer__And_Why_Epics_New_Store_Approach_Is_Huge.php
Epic Games acquires digital character specialist 3Lateral ,,http://www.gamasutra.com/view/news/334994/Epic_Games_acquires_digital_character_specialist_3Lateral.php
Analyst: PUBG out-earned every other premium PC and console game in 2018 ,,http://www.gamasutra.com/view/news/334636/Analyst_PUBG_outearned_every_other_premium_PC_and_console_game_in_2018.php
Digital Extremes and PUBG company Krafton looking for developers at PAX East,,http://www.gamesindustry.biz/articles/2019-01-21-digital-extremes-and-pubg-company-krafton-looking-for-developers-at-pax-east
"UK Charts: Ace Combat 7 breaks franchise records, but Mario holds No.1: Bandai Namco's flight game debuts at No.2",,https://www.gamesindustry.biz/articles/2019-01-20-uk-charts-ace-combat-7-breaks-franchise-records-but-mario-holds-no-1
Microsoft says its game streaming service has an advantage thanks to Xbox ,,http://www.gamasutra.com/view/news/334715/Microsoft_says_its_game_streaming_service_has_an_advantage_thanks_to_Xbox.php
"Microsoft CEO states ""Netflix for games"" ambitions: Satya Nadella points to game catalogue and PC business as key advantages over competitors",,https://www.gamesindustry.biz/articles/2019-01-21-microsoft-ceo-states-netflix-for-games-ambitions
"As Twitch Subscriber Race Heats Up, Ninja Is Annoyed That “Everyone’s Just Out To Look For The Next Guy”",,https://www.tubefilter.com/2019/01/17/twitch-subscriber-race-heats-ninja-is-annoyed/
"U.S. Congresswoman Alexandria Ocasio-Cortez Helps Twitch Streamer ‘Hbomberguy’ Raise $340,000+ For Transgender Nonprofit",,https://www.tubefilter.com/2019/01/21/alexandria-ocasio-cortez-hbomberguy-mermaids-transgender-twitch-fundraiser/
"Streamer raises $340,000 for trans charity by playingDonkey Kong 64 ",,http://www.gamasutra.com/view/news/334861/Streamer_raises_340000_for_trans_charity_by_playing_Donkey_Kong_64.php
"Games industry names help YouTuber raise $340,000 for trans charity in Donkey Kong 64 marathon: Grant Kirkhope, Jon Romero and Jim Sterling join the challenge",,https://www.gamesindustry.biz/articles/2019-01-22-games-industry-names-help-youtuber-raise-usd340-000-for-trans-charity-in-donkey-kong-64-marathon
Machinima has been wiped clean: The end of an era,,https://www.techspot.com/news/78356-machinima-has-wiped-clean.html
"Otter Media blocks all Machinima content on YouTube: Parent company says new Machinima content will be ""distributed on new channels"" to be announced later this year",,https://www.gamesindustry.biz/articles/2019-01-21-otter-media-blocks-all-machinima-content-on-youtube
Changing industry economics let Bungie forge a new destiny | Opinion - The idea of a developer operating an expensive online game would once have seemed ludicrous - Bungie's new independence shows how much has changed,,https://www.gamesindustry.biz/articles/2019-01-18-changing-industry-economics-let-bungie-forge-a-new-destiny
Capcom Really Loves Remaking Resident Evil 2,,https://kotaku.com/capcom-really-loves-remaking-resident-evil-2-1831879905
Resident Evil 2 Review,,https://ca.ign.com/articles/2019/01/22/resident-evil-2-review
"Resident Evil 2 remake review: Beautiful, terrifying, and annoying",,https://arstechnica.com/gaming/2019/01/resident-evil-2-remake-review-itll-thrill-you-itll-annoy-you/
Resident Evil 2's time-restricted demo has been downloaded over 3 million times ,,http://www.gamasutra.com/view/news/334885/Resident_Evil_2s_timerestricted_demo_has_been_downloaded_over_3_million_times.php
Blog: Overcoming genre in Ni No Kuni 2 ,,http://www.gamasutra.com/blogs/JustinReeve/20190115/334347/Overcoming_Genre.php
Starbreeze delays console release of Overkill's The Walking Dead ,,http://www.gamasutra.com/view/news/334711/Starbreeze_delays_console_release_of_Overkills_The_Walking_Dead.php
"Starbreeze delays Overkill's The Walking Dead on console: Troubled publisher pushes game beyond its planned February release, more information “at a later date”",,https://www.gamesindustry.biz/articles/2019-01-18-starbreeze-delays-overkills-the-walking-dead-on-console
How to build a Bandersnatch: Developers shares advice on how to create interactive movie games that can stand toe-to-toe with Black Mirror's latest,,https://www.gamesindustry.biz/articles/2019-01-18-how-to-build-a-bandersnatch
The Bandersnatch effect: Netflix's Black Mirror outing has everyone talking about interactive fiction -- but what does this mean for the game developers who got there first?,,https://www.gamesindustry.biz/articles/2019-01-17-the-bandersnatch-effect
Blog: How to make the marriage between cinema and games last ,,http://www.gamasutra.com/blogs/OmTandon/20190109/333860/Netflixs_Bandersnatch_UX_Cinema_meets_Gaming_how_to_make_the_marriage_last.php
Get a job: Crystal Dynamics is hiring a Camera Designer ,,http://www.gamasutra.com/view/news/334637/Get_a_job_Crystal_Dynamics_is_hiring_a_Camera_Designer.php
Hothead Games opens new publishing division ,,http://www.gamasutra.com/view/news/334879/Hothead_Games_opens_new_publishing_division.php
Metro Exodus publisher confident over showdown with Crackdown and Far Cry: Deep Silver on how it has readied a marketing assault ahead of crowded February 15 launch,,https://www.gamesindustry.biz/articles/2019-01-22-metro-exodus-goes-in-all-guns-blazing-against-crackdown-and-far-cry
Switch dominates a great year for game consoles in 2018,,https://arstechnica.com/gaming/2019/01/switch-dominates-a-great-year-for-game-consoles-in-2018/
NPD: The Nintendo Switch was the best-selling console of 2018 in the U.S. ,,http://www.gamasutra.com/view/news/335012/NPD_The_Nintendo_Switch_was_the_bestselling_console_of_2018_in_the_US.php
Super Smash Bros. Ultimate sold 5 million globally in first week: Nintendo president Shuntaro Furukawa says Nintendo Switch seeing fastest software sales in Nintendo history,,https://www.gamesindustry.biz/articles/2019-01-16-super-smash-bros-ultimate-sold-5-million-globally-in-first-week
Media Create: New Super Mario Bros. U Deluxe sells through over half of first-week shipment,,https://www.gamesindustry.biz/articles/2019-01-18-media-create-new-super-mario-bros-u-deluxe-sells-through-52-53-percent-of-first-week-shipment
Don't Miss: The secret history of Donkey Kong 9,,0
"Former PlayStation, Take-Two, Nintendo execs launch blockchain publisher: Planet Digital Partners will use $38m blockchain token sale to secure investment for up to ten new games",,https://www.gamesindustry.biz/articles/2019-01-17-former-playstation-take-two-nintendo-execs-launch-blockchain-investment-firm
Blog: Games and crowdfunding in 2018 ,,http://www.gamasutra.com/blogs/ThomasBidaux/20190115/334360/Games_and_Crowdfunding_in_2018.php
"Nexon reportedly up for sale: Tencent, EA, Activision, and Disney listed as interested parties in Korean publisher of MapleStory",,https://www.gamesindustry.biz/articles/2019-01-17-nexon-reportedly-up-for-sale
Layoffs hit NCSoft's Iron Tiger Studios: Publisher confirms an undisclosed number of layoffs at San Mateo developer,,https://www.gamesindustry.biz/articles/2019-01-21-layoffs-hit-ncsofts-iron-tiger-studios
"Supergiant's fourth outing Hades introduces a more mature, organized dev process ",,http://www.gamasutra.com/view/news/333495/Supergiants_fourth_outing_Hades_introduces_a_more_mature_organized_dev_process.php
Splash Damage has released the full game design document for Dirty Bomb ,,http://www.gamasutra.com/view/news/334689/Splash_Damage_has_released_the_full_game_design_document_for_Dirty_Bomb.php
Cloud Imperium Games spent $4M a month in 2017 developing Star Citizen ,,http://www.gamasutra.com/view/news/334717/Cloud_Imperium_Games_spent_4M_a_month_in_2017_developing_Star_Citizen.php
Blog: The mysteries of studying game design ,,http://www.gamasutra.com/blogs/JoshBycer/20190122/334736/The_Mysteries_of_Studying_Game_Design.php
Blog: Why nobody cares about your indie game ,,http://www.gamasutra.com/blogs/LewisDenby/20190117/334557/Why_nobody_cares_about_your_indie_game.php
"CI Games establishes United Label, a new publishing label dedicated to indies ",,http://www.gamasutra.com/view/news/334721/CI_Games_establishes_United_Label_a_new_publishing_label_dedicated_to_indies.php
"IndieDB, ModDB founder launches mod-focused publishing arm: Modularity to use mod.io to offer a ""fully cross-platform and store-agnostic modding solution""",,https://www.gamesindustry.biz/articles/2019-01-17-indiedb-moddb-founder-launches-mod-focused-publishing-arm
"With CryEngine's SpatialOS GDK in the works, Crytek reaffirms open-platform goals ",,http://www.gamasutra.com/view/news/335021/With_CryEngines_SpatialOS_GDK_in_the_works_Crytek_reaffirms_openplatform_goals.php
"US, Canada mobile gaming brought in $9.37 billion in 2018: Candy Crush games topped revenue charts for the year as puzzle, strategy, and casino genres dominated",,https://www.gamesindustry.biz/articles/2019-01-17-us-canada-mobile-gaming-brought-in-usd9-37-billion-in-2018
"Chad Wild Clay, Vy Qwaint Launch Mobile Game Inspired By Their Kids’ YouTube Spy Series",,https://www.tubefilter.com/2019/01/17/chad-wild-clay-vy-qwaint-mobile-game/
FIFA 19 trumped Red Dead and COD as Europe's highest selling game in 2018: Gfk Entertainment data shows EA Sports' football title as the most popular across 15 countries,,https://www.gamesindustry.biz/articles/2019-01-18-fifa-19-trumped-red-dead-and-call-of-duty-as-europes-highest-selling-game-in-2018
Sony is rolling out PlayStation Now to new European territories ,,http://www.gamasutra.com/view/news/335023/Sony_is_rolling_out_PlayStation_Now_to_new_European_territories.php
"Fast Travel Games sold more on PSVR than Steam, Oculus and Viveport combined: PSVR accounts for 58% of Apex Construct sales, said CEO Oskar Burman, and Sony's lead is getting wider",,https://www.gamesindustry.biz/articles/2019-01-18-fast-travel-games-sold-more-on-psvr-than-steam-oculus-and-viveport-combined
‘Apex Construct’ Studio: Big Boost in PSVR Installs Thanks to Recent Increase in Headset Sales,,https://www.roadtovr.com/apex-construct-studio-big-boost-psvr-installs-thanks-recent-increase-headset-sales/
"VR headsets, augmented windshields, and multiscreen infotainment at CES",,https://arstechnica.com/cars/2019/01/vr-headsets-augmented-windshields-and-multiscreen-infotainment-at-ces/
"""",,0
VR Train Simulator ‘Derail Valley’ to Launch into Early Access This Week,,https://www.roadtovr.com/vr-train-simulator-derail-valley-launch-early-access-week/
"The Digital Revolution: Fundamentals of virtual, mixed and augmented reality",,https://www.lexology.com/library/detail.aspx?g=726b55c4-f5f7-4aa1-8485-ddc99d5429f0
Mortal Kombat 11 gameplay as seen by a ‘90s arcade rat,,https://arstechnica.com/gaming/2019/01/mortal-kombat-11-gameplay-as-seen-by-a-1990s-arcade-rat/
"How European expansion bolstered Bulkhead against Brexit: Setting up a German subsidiary enabled recruitment of new talent amid political turmoil in the UK, says Bulkhead Interactive CEO Joe Brammer",,https://www.gamesindustry.biz/articles/2019-01-17-passport-control-how-european-expansion-bolstered-bulkhead-against-brexit
New esports league crops up around Farming Simulator 19 ,,http://www.gamasutra.com/view/news/335016/New_esports_league_crops_up_around_Farming_Simulator_19.php
"GAME's shares improve following ""solid"" Christmas results: UK dips offset by Spanish growth over festive period",,https://www.gamesindustry.biz/articles/2019-01-17-games-shares-improve-following-solid-christmas-results
Kingdom Hearts III Is An Unreviewable Video Game,,https://cl.s7.exct.net/?qs=9bc9b95366d5ad11febf598bee1bfb12f04d5561e349adbe037f750148bcf1615045912344eec101f73cd1a2760118e9efe032045c9ecfcd
"9 Video Game Secrets That Took Years to Find: In the olden days, programmers could hide something in the code of a video game and be confident that it would never be revealed. ",,https://ca.ign.com/videos/2019/01/21/9-video-game-secrets-that-took-years-to-find
"Alexandria Ocasio-Cortez, video games, and the new online town square",,https://arstechnica.com/gaming/2019/01/alexandria-ocasio-cortez-video-games-and-the-new-online-town-square/
Video: How I got my mom to play through Plants vs. Zombies ,,http://www.gamasutra.com/view/news/334903/Video_How_I_got_my_mom_to_play_through_Plants_vs_Zombies.php
DIGITAL,,0
"China creates app to tell you if you are near someone in debt and encourages you to report them: The app will allow the public shaming of ""deadbeat debtors""",,https://www.techspot.com/news/78405-china-creates-app-tell-you-if-you-near.html
Russia tries to force Facebook and Twitter to relocate servers to Russia,,https://arstechnica.com/tech-policy/2019/01/russia-tries-to-force-facebook-and-twitter-to-relocate-servers-to-russia/
"Pay for Trump’s border wall with $20 online porn fee, Ariz. lawmaker says",,https://arstechnica.com/tech-policy/2019/01/pay-for-trumps-border-wall-with-20-online-porn-fee-ariz-lawmaker-says/
Herrick V. Grindr – The Section 230 Case That's Not What You've Heard,,https://www.techdirt.com/articles/20190118/01175141419/herrick-v-grindr-section-230-case-thats-not-what-youve-heard.shtml
Supreme Court Refuses To Hear Case That Threatened CDA 230,,https://www.techdirt.com/articles/20190122/17160141446/supreme-court-refuses-to-hear-case-that-threatened-cda-230.shtml
There Was Heavy Tech Lobbying On Article 13... From The Company Hoping To Sell Everyone The Filters,,https://www.techdirt.com/articles/20190121/17024041437/there-was-heavy-tech-lobbying-article-13-company-hoping-to-sell-everyone-filters.shtml
"Disney is already losing over $1 billion in streaming, and its Netflix competitor has yet to launch",,https://www.cnbc.com/2019/01/18/disneys-streaming-efforts-are-already-losing-more-than-1-billion-and-they-havent-really-even-started.html
Lucasfilm Steps In After FanFilm That Tried To Follow The Rules Was Claimed By Disney Over Star Wars Music,,https://www.techdirt.com/articles/20190118/09321141421/lucasfilm-steps-after-fanfilm-that-tried-to-follow-rules-was-claimed-disney-over-star-wars-music.shtml
"Facebook may be hit with “record-setting fine” by FTC, report says",,https://arstechnica.com/tech-policy/2019/01/report-facebook-under-scrutiny-by-ftc-could-soon-owe-millions-in-fines/
Facebook Just Removed Hundreds of Pages Linked to Russia,,http://time.com/5505772/facebook-pages-russia/
President Trump Posts Altered Photos to Facebook and Instagram That Make Him Look Thinner,,https://gizmodo.com/president-trump-posts-altered-photos-to-facebook-and-in-1831909849
"Viral Is Still Copyrighted, Even to Learn Where Trump Is ",,https://www.lexology.com/library/detail.aspx?g=0c91662a-8c92-423c-b9d8-e17250ac4cc3
"Parody Washington Post Leads To Bogus Legal Threat, And A Reminder Of An Old Internet Lawsuit",,https://www.techdirt.com/articles/20190117/23121341418/parody-washington-post-leads-to-bogus-legal-threat-reminder-old-internet-lawsuit.shtml
Judge unseals trove of internal Facebook documents following our legal action,,https://www.revealnews.org/blog/a-judge-unsealed-a-trove-of-internal-facebook-documents-following-our-legal-action/
"Google, Facebook, and Amazon Spent Record Cash Lobbying Washington in 2018",,https://gizmodo.com/google-facebook-and-amazon-spent-record-cash-lobbying-1831982062
Google’s lobbying spending set new records in 2018,,https://arstechnica.com/tech-policy/2019/01/technology-giants-spent-millions-on-lobbying-in-2018/
Blocking Constituents from Facebook Page Violates First Amendment–Davison v. Randall,,https://blog.ericgoldman.org/archives/2019/01/blocking-constituents-from-facebook-page-violates-first-amendment-davison-v-randall.htm
"Why Silicon Valley’s “growth at any cost” is the new “unsafe at any speed”: For years, Ashkan Soltani has warned of Facebook's privacy-eroding tendencies.",,https://arstechnica.com/tech-policy/2019/01/researcher-as-tech-firms-grow-rapidly-privacy-violations-must-be-intentional/
Fourth Amendment Limits NYC’s Demands for Airbnb Customer Records,,https://blog.ericgoldman.org/archives/2019/01/fourth-amendment-limits-nycs-demands-for-airbnb-customer-records.htm
"Pie Company Has A Rogue Twitter Impostor, But Decides To Be Totally Cool With It",,https://www.techdirt.com/articles/20190117/09121941410/pie-company-has-rogue-twitter-impostor-decides-to-be-totally-cool-with-it.shtml
Lawmakers seek harsh penalties against ZTE and Huawei,,https://arstechnica.com/tech-policy/2019/01/lawmakers-seek-harsh-penalties-against-zte-and-huawei/
US asks Canada to turn over Huawei’s CFO on alleged sanctions violations,,https://arstechnica.com/tech-policy/2019/01/us-asks-canada-to-turn-over-huaweis-cfo-on-alleged-sanctions-violations/
Will Social Media Websites Become State Actors?,,https://www.lexology.com/library/detail.aspx?g=f524deaf-b48d-409a-9f6b-40f4aac1cca7
Researchers discover state actor’s mobile malware efforts because of YOLO OPSEC,,https://arstechnica.com/information-technology/2019/01/researchers-discover-state-actors-mobile-malware-efforts-because-of-yolo-opsec/
BuzzFeed Set to Lay Off 15% of Its Employees,,https://variety.com/2019/digital/news/buzzfeed-layoff-15-percent-employees-1203116266/
Why Do People Fall for Fake News?,,https://www.nytimes.com/2019/01/19/opinion/sunday/fake-news.html
Deepfakes and the New Disinformation War: The Coming Age of Post-Truth Geopolitics,,https://www.foreignaffairs.com/articles/world/2018-12-11/deepfakes-and-new-disinformation-war?cid=soc-tw-rdr
"Social media can predict what you’ll say, even if you don’t participate",,https://arstechnica.com/science/2019/01/social-media-can-predict-what-youll-say-even-if-you-dont-participate/
“The Linux of social media”—How LiveJournal pioneered (then lost) blogging,,https://arstechnica.com/gadgets/2019/01/the-linux-of-social-media-how-livejournal-pioneered-then-lost-web-blogging/
Not all Opinions are Fit for Sharing,,https://www.lexology.com/library/detail.aspx?g=2ad5b499-5e4c-419f-8ea2-92318beb32d4
Risky Business Just Got Riskier - DOJ Changes Stance on Internet Gambling,,https://www.lexology.com/library/detail.aspx?g=d48607c4-e0d0-4c26-a8ca-b2f938b15b92
DOJ Opinion Leaves Industry Hanging: If UIGEA Exclusions Don’t Modify the Wire Act What Does That Mean for Intrastate Gambling Transactions? ,,https://www.lexology.com/library/detail.aspx?g=adffaad1-15f2-4d5b-b3b7-bda66635bcbe
"Hulu Drops Price Of Ad-Supported Subscription Plan, Increases Price For Hulu With Live TV",,https://www.tubefilter.com/2019/01/23/hulu-price-subscription-tiers-hulu-with-live-tv-price/
Hulu will make its basic plan cheaper as Netflix gets pricier,,https://arstechnica.com/gadgets/2019/01/hulu-will-make-its-basic-plan-cheaper-as-netflix-gets-pricier/
US Media Companies Engaging In Proactive Censorship Of Content Ahead Of India's New Hate Speech Laws,,https://www.techdirt.com/articles/20190120/08134141430/us-media-companies-engaging-proactive-censorship-content-ahead-indias-new-hate-speech-laws.shtml
"Netflix Signs Indian Content Code Banning Offensive Material, Agrees To Self-Regulate",,https://www.tubefilter.com/2019/01/17/netflix-code-best-practices-india-digital-content-regulation/
Netflix Spent $12 Billion on Content in 2018. Analysts Expect That to Grow to $15 Billion This Year,,https://variety.com/2019/digital/news/netflix-content-spending-2019-15-billion-1203112090/
Netflix Joins the Motion Picture Association of America,,https://variety.com/2019/biz/news/netflix-mpaa-1203114133/
"Why Does Everyone Else Want To Stop Netflix Password Sharing, When Netflix Is Fine With It?",,https://www.techdirt.com/articles/20190111/15495841378/why-does-everyone-else-want-to-stop-netflix-password-sharing-when-netflix-is-fine-with-it.shtml
Netflix on streaming rivals: ‘We compete with (and lose to) Fortnite more than HBO’,,https://www.geekwire.com/2019/netflix-streaming-rivals-compete-lose-fortnite-hbo/
The whirlwind success of Netflix's 'You' and 'Bird Box' shows it's become a well-oiled FOMO machine,,https://www.businessinsider.com/netflixs-you-and-bird-box-success-show-its-become-a-fomo-machine-2019-1
The Great Google Hangouts Shutdown begins October 2019,,https://arstechnica.com/gadgets/2019/01/the-great-google-hangouts-shutdown-begins-october-2019/
